Name,Review_Count,Rating,Prices,Description,Ingredients,Cal,Nutrition,url
Genius Gluten Free Fibre Fest Cob,(15),4.9,3.40,Gluten Free Multi Seed Cob with Linseed,"Water, Starches (Potato, Maize, Tapioca), Mixed Seeds (21%) (Linseed, Sunflower, Millet, Flaxseed, Poppy), Rice Flour, Chicory Root Fibre, Rapeseed Oil, Psyllium Husk, Humectant (Vegetable Glycerol), Yeast, Stabilisers (Hydroxypropyl Methyl Cellulose, Xanthan Gum), Black Treacle, Iodised Salt (Salt, Potassium Iodate), Free Range Dried Egg White, Apple Extract, Fermented Maize Starch, Vitamins & Minerals: Calcium Carbonate, Niacin, Iron, Riboflavin, Thiamine, Folic Acid",Nan,Energy 1186kJ / 283kcal913kJ / 218kcal11%Fat 9.6g7.4g11% of which saturates 0.8g0.6g3%Carbohydrate 40g31g12% of which sugars 1.8g1.4g2%Fibre 9.4g7.2gProtein 4.1g3.2g6%Salt 1g0.79g13%Thiamine (B1) 0.19mg0.15mg15%Riboflavin (B2) 0.40mg0.31mg24%Niacin 2.1mg1.6mg10%Folic Acid 25µg19µg10%Calcium 171mg132mg16%Iron 3.1mg2.4mg17%Omega 3 Fatty Acids962mg741mgVitamins & Minerals:--,https://www.tesco.com/groceries/en-GB/products/303617504
Tesco Free From Carl The Caterpillar Cake,(16),3.1,6.00,"Gluten free chocolate cake filled with chocolate flavoured frosting, covered with chocolate sugar paste and decorated with icing and sugar strands.","INGREDIENTS: Sugar, Rapeseed Oil, Water, Pasteurised Egg, Cocoa Powder, Glucose Syrup, Rice Flour, Invert Sugar Syrup, Palm Oil, Tapioca Flour, Potato Flour, Humectant (Glycerine), Emulsifiers (Mono- and Di-Glycerides of Fatty Acids, Carboxymethylcellulose), Soya Bean, Maize Flour, Sugar Strands [Sugar, Colours (Titanium Dioxide, Paprika Extract, Curcumin, Beetroot Red), Glazing Agent (Shellac), Coconut Oil, Glucose Syrup), Salt, Colours (Paprika Extract, Calcium Carbonate, Beetroot Red, Beta-Carotene, Iron Oxide, Lutein], Stabilisers (Tragacanth, Gellan Gum), Raising Agents (Calcium Phosphate, Sodium Carbonate), Acidity Regulators (Dipotassium Phosphate, Potassium Phosphate, Citric Acid, Ascorbic Acid), Flavouring, Thickener (Xanthan Gum), Dried Egg, Preservative (Potassium Sorbate), Fruit & Vegetable Concentrate (Spirulina, Safflower), Apple Extract.",Energy 1766kJ / 421kcal ,Energy1766kJ / 421kcal883kJ / 211kcalFat18.5g9.3gSaturates4.4g2.2gCarbohydrate57.9g29.0gSugars46.9g23.5gFibre2.8g1.,https://www.tesco.com/groceries/en-GB/products/291548490
Thorntons Indulgent Chocolate Gift Cake,(7),2.1,4.00,"Chocolate Sponge Filled and Covered with Chocolate Flavour Buttercream, Topped with Chocolate Flavour and Toffee Flavour Buttercreams and Finished with Edible Decorations.","Sugar, Butter (Milk), Glucose Syrup, Pasteurised Egg, Wheat Flour (Wheat Flour, Calcium Carbonate, Iron, Niacin, Thiamin), Rapeseed Oil, Fat Reduced Cocoa Powder, Humectant (Glycerol), Invert Sugar Syrup, Wheat Starch, Tapioca Starch, Maize Starch, Raising Agents (E450, Sodium Hydrogen Carbonate), Whipping Cream (Milk), Palm Oil, Cocoa Butter, Cocoa Mass, Emulsifiers (E471, Soya Lecithin), Preservative (Potassium Sorbate), Whole Milk Powder, Colour (Caramel), Dextrose, Cocoa Powder, Modified Maize Starch, Acidity Regulators (Citric Acid, Sodium Hydroxide), Dried Egg White, Flavouring",Nan,Energy 1815 kJ1325 kJ-434 kcal317 kcalFat 21.9 g16.0 g of which Saturates 9.6 g7.0 gCarbohydrate 55.2 g40.3 g of which Sugars 43.1 ,https://www.tesco.com/groceries/en-GB/products/301044637
Juvela Gluten Free Fresh White Loaf 400G,(21),4.2,2.80,Soft White Loaf,"Gluten Free Wheat Starch*, Water, Dried Skimmed Milk Powder, Vegetable Oil (Rapeseed), Bamboo Fibre, Sugar, Yeast, Stabilisers (Guar Gum, Xanthan Gum, Hydroxypropylmethycellulose), Salt, Preservative (Sorbic Acid), Iron Powder, Niacin, Riboflavin, Thiamine, Vitamin B6, Folic Acid, *This ingredient complies with the Codex Alimentarius standard for Gluten-Free foods",Nan,Energy 936kJ221kcal271kJ/64kcalFat 2.4g0.7g of which saturates 0.5g0.1gCarbohydrate 44g13g of which sugars 3.8g1.4gFibre 4.7g1.8gProtein 3.8g1.1gSalt 0.9g0.3gNiacin 2.6mg0.8mgRiboflavin0,https://www.tesco.com/groceries/en-GB/products/297747347
Bosh Luscious Lemon Cake,(40),3.5,3.50,"Lemon flavoured sponge with a lemon syrup, topped with a lemon flavoured icing and edible decorations.","Sugar, Wheat Flour (Wheat Flour, Calcium Carbonate, Iron, Niacin, Thiamin), Rapeseed Oil, Water, Lemon Juice, Humectant (Glycerine), Broad Bean Protein, Tapioca Starch, Alpha Cyclodextrin, Maize Starch, Raising Agents (Diphosphates, Potassium Bicarbonate), Lemon Peel, Glucose Fructose Syrup, Preservative (Potassium Sorbate), Lemon Oil, Emulsifier (Mono and Diglycerides of Fatty Acids), Acidity Regulator (Citric Acid), Lemon Flavoured Icing 18%, Lemon Syrup 4%",Nan,Energy 1716kJ942kJ-409kcal224kcalFat 15.7g8.6g of which,https://www.tesco.com/groceries/en-GB/products/305978303
Tesco 6 Celebration Cupcakes,(1),2,3.00,6 Vanilla sponge cakes topped with strawberry and vanilla flavoured frostings and decorated.,"INGREDIENTS LIST:Strawberry Flavoured Frosting (23%), Vanilla Flavoured Frosting (23%), Sugar, Wheat Flour (Wheat Flour, Calcium Carbonate, Iron, Niacin, Thiamin), Pasteurised Egg, Rapeseed Oil, Pink Shimmer Sugar, Modified Maize Starch, Whey Powder (Milk), Raising Agents (Potassium Carbonate, Disodium Diphosphate, Calcium Phosphate), Preservatives (Potassium Sorbate, Calcium Propionate), Emulsifiers (Polyglycerol Esters of Fatty Acids, Mono- and Di-Glycerides of Fatty Acids), Maize Starch, Stearic Acid, Flavouring, Acidity Regulator (Potassium Hydroxide).Strawberry Flavoured Frosting contains: Icing Sugar, Palm Oil, Rapeseed Oil, Water, Colours (Beetroot Red, Annatto, Curcumin), Salt, Emulsifier (Mono- and Di-Glycerides of Fatty Acids), Flavourings.Vanilla Flavoured Frosting contains: Icing Sugar, Palm Oil, Rapeseed Oil, Water, Salt, Flavourings, Emulsifiers (Mono- and Di-Glycerides of Fatty Acids), Colours (Annatto, Curcumin).Pink Shimmer Sugar contains: Sugar, Glazing Agent (Shellac), Invert Sugar Syrup, Colour (Titanium Dioxide), Apple Concentrate, Blackcurrant Concentrate, Radish Concentrate.",Energy 2129kJ / 510kcal ,Energy2129kJ / 510kcal1299kJ / 311kcalFat29.3g17.9gSaturates8.1g4.9gCarbohydrate58.5g35.7gSugars50.3g30.7gFibre1.0g0.,https://www.tesco.com/groceries/en-GB/products/297571370
Warburtons Gluten Free Multiseed Boule 400G,(5),3.8,3.40,Unsliced Gluten Free Multiseed Bread with Sourdough,"Water, Tapioca Starch, Seed Mix (6%) (Sunflower Seed, Linseed, Millet Seed, Poppy Seed, Quinoa), Potato Starch, Maize Starch, Yeast, Rapeseed Oil, Egg White Powder, Stabiliser: E464, Vegetable Fibre (Psyllium), Sugar, Gluten Free Sourdough Powder (from Rice), Fruit Extract (Carob and Apple), Rice Flour, Salt, Humectant: Vegetable Glycerine, Caramelised Sugar, Natural Flavouring, Preservatives: Calcium Propionate, Potassium Sorbate",Nan,Energy1117kJ-2,https://www.tesco.com/groceries/en-GB/products/304406879
La Boulangere 6 Vegan Croissants 240G,(6),5,2.40,6 Vegan Croissants,"<strong>Wheat</strong> Flour, Shea Fat, Water, Sunflower Oil, Sugar, Leaven (Water, Flours: <strong>Wheat</strong>, <strong>Rye</strong>, Malted <strong>Wheat</strong>; Yeast), Yeast, Emulsifiers: Mono- and Diglycerides of Fatty Acids, Polyglycerol Esters of Fatty Acids, Salt, <strong>Wheat Gluten</strong>, Natural Flavourings (contain Alcohol <1%), Vegetable Proteins (from Pea), Colour: Carotenes, Acerola Extract",Nan,Energy 1709kJ/408kcal687kJ/164kcalFat 21g8.4g of which satura,https://www.tesco.com/groceries/en-GB/products/305974647
Mrs Crimbles 5 Jammy Loaf Cakes 150G,(2),5,2.50,5 Gluten Free Sponge Cakes with Raspberry Filling,"Raspberry Filling 25% (Glucose-Fructose Syrup, Sugar, Raspberry Puree (10%), Stabilizer: Glycerol, Concentrated Raspberry Puree (4%), Natural Flavouring, Natural Raspberry Flavouring with other Natural Flavours, Acid: Citric Acid; Gelling Agent: Pectin; Acidity Regulator: Sodium Citrate, Elderberry Juice), Eggs, Sugar, Rapeseed Oil, Rice Flour, Potato Starch, Stabilizer: Glycerol, Starch (Rice, Corn), Natural Flavourings, Raising Agents: Diphosphates, Sodium Carbonates, Salt, Dextrose, Thickener: Carboxymethylcellulose",Nan,Energy 1798kJ / 428kcal540kJ / 129kcalFat 18.0g5.4g of wh,https://www.tesco.com/groceries/en-GB/products/303673160
Mrs Crimble's Classic Madeleine 180G,(6),4.2,2.20,6 Individually Wrapped Gluten Free Sponge Cakes,"Eggs, Sugar, Rapeseed Oil, Rice Flour, Potato Starch, Stabilizer: Glycerol, Starch (Rice, Corn), Natural Flavours, Baking Powders (Disodium Diphosphate and Sodium Bicarbonate), Salt, Dextrose, Thickener: Xanthan Gum",Nan,Energy 1839kJ552kJ-439kcal132kcalFat 23.0g6.9gof w,https://www.tesco.com/groceries/en-GB/products/292832035
Mr Kipling 8 Chocolate Orange Fancies,(2),3,2.50,"Chocolate flavoured sponge cakes with an orange flavoured topping (11%), covered with chocolate fondant icing (49%).","Icing Sugar, Sugar, Water, Wheat Flour (with Added Calcium, Iron, Niacin, Thiamin), Glucose Syrup, Vegetable Oils (Palm, Rapeseed, Shea), Dark Chocolate (Cocoa Mass, Sugar, Cocoa Butter, Emulsifier (Soya Lecithin)), Vegetable Margarine (Vegetable Oils (Palm, Rapeseed), Water, Salt), Fat Reduced Cocoa Powder, Humectant (Vegetable Glycerine), Dried Egg, Milk Proteins, Dried Egg White, Whey Powder (Milk), Salt, Raising Agents (Disodium Diphosphate, Sodium Bicarbonate), Emulsifiers (Mono- and Diglycerides of Fatty Acids, Soya Lecithin), Barley Malt Extract, Natural Orange Flavouring, Preservative (Potassium Sorbate), Maize Starch, Colour (Paprika Extract), Flavourings",Energy 1578kJ ,Energy 1578kJ446kJ-375kcal106kcalFat 10.8g3.1g of which Saturates 5.0g1.4gCarbohydrate 65.6g18.5g of ,https://www.tesco.com/groceries/en-GB/products/305959891
Tesco 2 Free From Cinnamon Swirls,(24),2.9,2.20,2 Gluten free pastries filled with a cinnamon crème pâtissière and cinnamon sugar.,"INGREDIENTS: Vegetable Oil and Butter Blend (19%) [Water, Palm Oil, Coconut Oil, Rapeseed Oil, Concentrated Butter (Milk), Emulsifiers (Mono- and Di-Glycerides of Fatty Acids, Sunflower Lecithins, Mono- and Di-Acetyl Tartaric Acid Esters of Mono- and Di-Glycerides of Fatty Acids), Flavouring, Salt, Acidity Regulators (Lactic Acid, Citric Acid), Colour (Beta-Carotene)], Cinnamon Crème Pâtissière (17%) [Water, Sugar, Modified Potato Starch, Cinnamon, Palm Oil, Milk Proteins, Acidity Regulators (Calcium Carbonate, Calcium Lactate), Fermented Brown Rice Flour, Thickener (Sodium Alginate), Dried Egg White, Flavouring, Glucose Syrup, Salt, Colour (Beta-Carotene), Brown Rice Flour], Rice Flour, Tapioca Starch, Water, Potato Starch, Sugar, Thickeners (Hydroxypropyl Methyl Cellulose, Xanthan Gum), Pea Flour, Vegetable Fibres (Pea Fibre, Potato Fibre, Citrus Fibre, Rice Fibre, Flax Fibre, Psyllium Husk Fibre, Seaweed Fibre), Fructose, Yeast, Millet Flour, Whole Flax Seed Meal, Salt, Yeast Extract, Cinnamon, Fermented Brown Rice Flour, Brown Rice Flour, Flavouring.",Energy 1364kJ / 326kcal ,Energy1364kJ / 326kcal1296kJ / 309kcalFat14.9g14.2gSaturates8.8g8.4gCarbohydrate44.0g41.8gSugars7.1g6.7gFibre1.7g1.,https://www.tesco.com/groceries/en-GB/products/304791496
Tesco Free From Chocolate Chip Mini Muffin 200G,(3),2.7,2.00,"Gluten free sponge made with rice flour, with dark chocolate chips.","INGREDIENTS: Pasteurised Egg, Sugar, Potato Starch, Rapeseed Oil, Dark Chocolate (13%) [Cocoa Mass, Sugar, Cocoa Butter, Fat Reduced Cocoa Powder, Emulsifiers (Soya Lecithins)], Humectant (Glycerol), Rice Flour, Invert Sugar Syrup, Maize Starch, Dried Skimmed Milk, Water, Raising Agents (Potassium Bicarbonate, Disodium Diphosphate, Sodium Bicarbonate), Emulsifiers (Sodium Stearoyl-2-Lactylate, Polyglycerol Esters of Fatty Acids, Mono- and Di-Glycerides of Fatty Acids), Thickener (Xanthan Gum), Flavouring, Preservative (Potassium Sorbate).",Energy 1810kJ / 432kcal ,Energy1810kJ / 432kcal344kJ / 82kcalFat20.1g3.8gSaturates4.0g0.8gCarbohydrate57.1g10.8gSugars31.1g5.9gFibre1.7g0.,https://www.tesco.com/groceries/en-GB/products/300643984
Tesco Fresh Free From Hot Cross Buns 4 Pack,(4),4.8,1.90,Gluten free cinnamon spiced hot cross buns with sultanas and currants.,"INGREDIENTS: Water, Sultanas (10%), Rice Flour, Currants (6%), Tapioca Starch, Sugar, Maize Flour, Potato Starch, Bamboo Fibre, Yeast, Rapeseed Oil, Dried Egg White, Psyllium Husk Powder, Humectant (Glycerol), Stabilisers (Hydroxypropyl Methyl Cellulose, Xanthan Gum), Sunflower Oil, Potato Dextrin, Mixed Spices, Salt, Preservatives (Calcium Propionate, Potassium Sorbate), Cinnamon, Flavouring.",Energy 971kJ / 231kcal ,Energy971kJ / 231kcal680kJ / 161kcalFat3.7g2.6gSaturates0.3g0.2gCarbohydrate41.2g28.8gSugars17.8g12.5gFibre7.8g5.,https://www.tesco.com/groceries/en-GB/products/281823783
Tesco Chocolate Brownie 240G,(1),5,1.75,Chocolate brownie slices with dark chocolate chunks.,"INGREDIENTS: Sugar, Pasteurised Egg, Milk Chocolate (11%) [Sugar, Cocoa Butter, Dried Whole Milk, Cocoa Mass, Emulsifier (Soya Lecithins), Flavouring], Wheat Flour [Wheat Flour, Calcium Carbonate, Iron, Niacin, Thiamin], Dark Chocolate Chunks (6%) [Sugar, Cocoa Mass, Cocoa Butter, Emulsifier (Soya Lecithins), Flavouring], Butter (Milk), Fat Reduced Cocoa Powder, Palm Oil, Stabiliser (Acacia Gum), Rapeseed Oil, Coconut Oil, Flavouring, Preservative (Potassium Sorbate), Emulsifier (Mono- and Di-Glycerides of Fatty Acids).",Energy 1771kJ / 423kcal ,Energy1771kJ / 423kcal708kJ / 169kcalFat19.5g7.8gSaturates9.8g3.9gCarbohydrate55.0g22.0gSugars42.8g17.1gFibre1.9g0.,https://www.tesco.com/groceries/en-GB/products/305967495
Tesco Free From 12 Chocolate Mini Brownies Bites,(1),3,2.50,"Gluten free mini brownie bites made with dark chocolate, almonds and rice flour.","INGREDIENTS: Belgian Dark Chocolate (32%) [Sugar, Cocoa Mass, Cocoa Butter, Emulsifier (Soya Lecithins), Flavouring], Sugar, Butter (Milk), Margarine [Palm Oil, Rapeseed Oil, Water, Coconut Oil, Emulsifier (Mono- and Di-Glycerides of Fatty Acids), Flavouring], Fat Reduced Cocoa Powder (6%), Water, Humectant (Glycerol), Pasteurised Dried Egg, Rice Flour, Almonds, Potato Starch, Cornflour, Thickener (Xanthan Gum), Raising Agents (Disodium Diphosphate, Sodium Bicarbonate).",Energy 1958kJ / 469kcal ,Energy1958kJ / 469kcal235kJ / 56kcalFat27.8g3.3gSaturates13.6g1.6gCarbohydrate44.3g5.3gSugars34.3g4.1gFibre4.4g0.5,https://www.tesco.com/groceries/en-GB/products/297172099
Tesco Salted Caramel Bar Cake,(4),3,2.00,"Caramel flavoured sponge filled with salted caramel sauce, topped with salted caramel frosting and finished with milk chocolate decorations, milk, dark, and white chocolate cereal balls, fudge pieces, white chocolate chips, dark chocolate decorations and edible gold decorations.","INGREDIENTS: Salted Caramel Frosting (25%) [Sugar, Butter (Milk), Double Cream (Milk), Dark Brown Sugar, Salt, Cornflour, Flavouring, Caramelised Sugar Syrup], Wheat Flour [Wheat Flour, Calcium Carbonate, Iron, Niacin, Thiamin], Sugar, Salted Caramel Sauce (8%) [Double Cream (Milk), Dark Brown Sugar, Sugar, Butter (Milk), Water, Cornflour, Salt], Pastuerised Egg, Rapeseed Oil, Humectant (Glycerol), Treacle, Partially Inverted Sugar Syrup, Milk Chocolate Decorations (2%) [Sugar, Cocoa Butter, Dried Whole Milk, Cocoa Mass, Whey Powder (Milk), Milk Sugar, Emulsifier (Soya Lecithins), Flavouring], Pastuerised Egg White, Palm Oil, Milk, Dark and White Chocolate Cereal Balls [Wheat Flour (Wheat Flour, Calcium Carbonate, Iron, Niacin, Thiamin), Sugar, Cocoa Butter, Cocoa Mass, Rice Flour, Shea Fat, Palm Oil, Dried Skimmed Milk, Dried Whole Milk, Whey Powder (Milk), Milk Sugar, Emulsifiers (Soya Lecithins, Mono- and Di-Glycerides of Fatty Acids, Sunflower Lecithins), Anhydrous Milk Fat, Salt, Rapeseed Oil, Raising Agent (Sodium Carbonates), Flavouring, Glazing Agent (Shellac), Stabiliser (Acacia Gum), Coconut Oil, Honey, Acidity Regulator (Citric Acid)], Fudge Pieces [Sugar, Glucose Syrup, Milk, Palm Oil, Emulsifier (Mono- and Di-Glycerides of Fatty Acids), Humectant (Glycerol), Salt], White Chocolate Chips [Sugar, Cocoa Butter, Dried Whole Milk, Milk Sugar, Whey Powder (Milk), Emulsifier (Soya Lecithins), Flavouring], Dark Chocolate Decorations [Sugar, Cocoa Mass, Cocoa Powder, Emulsifier (Soya Lecithins)], Raising Agents (Disodium Diphosphate, Sodium Bicarbonate), Edible Gold Decorations [Sugar, Rice Flour, Coconut Oil, Shea Fat, Caramelised Sugar Syrup, Thickener (Sodium Carboxymethylcellulose), Colours (Titanium Dioxide, Iron Oxide), Glazing Agent (Shellac), Concentrates (Apple Concentrate, Safflower Concentrate, Lemon Concentrate), Tapioca Starch, Flavouring], Emulsifier (Mono- and Di-Glycerides of Fatty Acids), Caramelised Sugar Syrup, Cane Molasses.",Energy 1720kJ / 410kcal ,Energy1720kJ / 410kcal946kJ / 225kcalFat17.4g9.6gSaturates6.7g3.7gCarbohydrate59.3g32.6gSugars40.0g22.0gFibre0.9g0.,https://www.tesco.com/groceries/en-GB/products/305829439
Tesco Fruit & Nut Flapjack Bites 300G,No ratings yet,Nan,2.00,"Oat flapjacks with apricots, sultanas, hazelnuts and almonds topped with milk chocolate.","INGREDIENTS:  Oats, Milk Chocolate (15%) [Sugar, Cocoa Butter, Cocoa Mass, Dried Skimmed Milk, Milk Fat, Milk Sugar, Emulsifier (Soya Lecithins)], Partially Inverted Refiners Syrup (Sulphites), Sugar (Sulphites), Palm Oil, Sultana, Skimmed Milk, Butter (Milk), Caramel [Sugar (Sulphites), Glucose Syrup (Sulphites), Palm Oil, Brown Sugar (Sulphites), Whole Milk, Rapeseed Oil, Salt, Emulsifier (Soya Lecithins), Flavouring, Colour (Carotenes)], Apricot [Apricot (Sulphites), Rice Flour], Rapeseed Oil, Hazelnut, Almonds, Coconut Oil, Salt, Emulsifier (Mono- and Di-Glycerides of Fatty Acids), Flavouring.",Energy 1980kJ / 473kcal ,Energy1980kJ / 473kcal297kJ / 71kcalFat22.5g3.4gSaturates9.5g1.4gCarbohydrate59.7g9.0gSugars41.4g6.2gFibre3.2g0.5,https://www.tesco.com/groceries/en-GB/products/303720208
Soreen Snack Pack Malt 45G,(1),3,1.00,2 slices of fruited malt loaf with salted butter,"Fortified Wheat Flour (Wheat Flour, Calcium Carbonate, Iron, Niacin (B3), Thiamin (B1)), Water, Raisins (14%), Maize Starch, Partially Inverted Sugar Syrup (Partially Inverted Sugar Syrup, Colour: E150c), Malted Barley Flour (5%), Barley Malt Extract (4.4%), Dried Whey from Cows Milk), Vegetable Fat (Rapeseed, Palm), Salt, Yeast, Preservative: Calcium Propionate, Salted Butter (6.7%) (Butter (from Cows Milk)",Energy 1402kJ ,Energy 1402kJ631kJ-333kcal150kcalFat 8.6g3.9gof which saturates 5,https://www.tesco.com/groceries/en-GB/products/303088737
Hovis Wholemeal Loaf,(1),5,0.80,Hovis Wholemeal loaf with malted wheat flakes topped with wheat bran,"INGREDIENTS: Wholemeal Wheat Flour, Water, Malted Wheat Flakes (3%), Yeast, Wheat Bran (2%), Caramelised Sugar, Wheat Protein, Fermented Wheat Flour, Salt, Vegetable Fat (Palm, Rapeseed), Soya Flour, Wheat Flour (Wheat Flour, Calcium Carbonate, Iron, Niacin, Thiamin), Flour Treatment Agent (Ascorbic Acid), Wheat Starch.",Energy 956kJ / 226kcal ,Energy956kJ / 226kcal956kJ / 226kcalFat2.2g2.2gSaturates0.3g0.3gCarbohydrate39.1g39.1gSugars5.4g5.4gFibre6.3g6.3,https://www.tesco.com/groceries/en-GB/products/305946468
Mr Kipling Gluten Free Brownie Slice 4 Pack,(2),2.5,2.25,"Gluten Free Brownie Slices Baked with Dark Chocolate (19%), Dark Chocolate Chips (7%) and Ground Almonds (5%).","Sugar, Dark Chocolate (Cocoa Mass, Sugar, Cocoa Butter, Emulsifier (Sunflower Lecithin)), Egg, Rapeseed Oil, Dark Chocolate Chips (Cocoa Mass, Sugar, Cocoa Butter, Emulsifier (Sunflower Lecithin)), Ground Almonds, Rice Flour, Tapioca Starch, Concentrated Grape Juice, Rice Starch, Acid (Ascorbic Acid), Preservative (Potassium Sorbate), Raising Agents (Calcium Phosphate, Sodium Bicarbonate)",Energy 2005kJ ,Energy 2005kJ601kJ-480kcal144kcalFat 27.4g8.2g of which Saturates6.6g2.0gCarbohydrate50.7g15.2,https://www.tesco.com/groceries/en-GB/products/297673595
Mr Kipling Mini Fruit Pies 9 Pack,No ratings yet,Nan,2.00,"3 Mini Bramley Apple Pies - Pastry cases with a Bramley apple filling (46%), finished with a dusting of sugar.
3 Mini Bramley Apple & Blackcurrant Pies - Pastry cases with a Bramley apple & blackcurrant filling (46%), finished with a dusting of sugar.
3 Mini Cherry Pies - Pastry cases with a cherry filling (46%), finished with a dusting of sugar.","Best stored in a cool, dry place",Energy 1592kJ ,Energy1592kJ451kJ-379kcal107kcalFat13.9g3.9g of which Satura,https://www.tesco.com/groceries/en-GB/products/305055128
Soreen Fruity Five Large Loaf 260G,(1),5,1.20,"A moist fruit loaf with sultanas, cherries, currants, lemon and orange peel","Fortified Wheat Flour (Wheat Flour, Calcium Carbonate, Iron, Niacin (B3), Thiamin (B1)), Water, Sultanas (12%), Glace Cherries (6.7%) (Cherry, Glucose-Fructose Syrup, Sugar, Citric Acid, Colour: Erythrosine), Partially Inverted Sugar Syrup (Partially Inverted Sugar Syrup, Colouring: E150c), Currants (4%), Sugar, Vegetable Fat (Rapeseed, Palm), Sweetened Mixed Citrus Peel (2%) (Orange Peel, Lemon Peel, Glucose-Fructose Syrup, Sugar, Acidity Regulator: Citric Acid), Malted Barley Flour, Wheat Gluten, Dried Whey (from Cows Milk), Salt, Mixed Spice, Yeast, Preservative: Calcium Propionate, Flavouring",Energy 1278 kJ ,Energy1278 kJ665 kJ-303 kcal158 kcalFat4.6 g2.4 g of which saturates0.8 g0.,https://www.tesco.com/groceries/en-GB/products/266616020
Norfolk Cake Co Cinnamon Flapjack,No ratings yet,Nan,0.85,A hand finished syrupy flapjack,"Jumbo Oats (48%), Golden Syrup (23%), Vegetable Margarine (Palm Oil, Rapeseed Oil, Salt, Water), Sugar, Ground Cinnamon, Raising Agents (Diphosphates, Sodium Bicarbonate)",Nan,Energy 1772 kj/424 kcalFat 19.96 g ,https://www.tesco.com/groceries/en-GB/products/288389951
Hovis 7 Seeds Loaf,(1),5,1.00,Hovis Multiseeded loaf,"INGREDIENTS: Wheat Flour (Wheat Flour, Calcium Carbonate, Iron, Niacin, Thiamin), Water, Seeds (14%) (Toasted Brown Linseed, Sunflower Seeds, Pumpkin Seeds, Toasted Sunflower Seeds, Millet, Golden Linseed  Poppy Seeds), Yeast, Wheat Protein, Salt, Fermented Wheat Flour, Vegetable Fat (Palm, Rapeseed), Caramelised Sugar, Soya Flour, Flour Treatment Agent (Ascorbic Acid), Wheat Starch.",Energy 1143kJ / 271kcal ,Energy1143kJ / 271kcal1143kJ / 271kcalFat6.8g6.8gSaturates0.6g0.6gCarbohydrate39.2g39.2gSugars4.4g4.4gFibre4.7g4.7gP,https://www.tesco.com/groceries/en-GB/products/305948218
Pokemon Celebration Cake,(2),3.5,10.50,"Sponge with a layer of raspberry jam and sweet filling, covered with soft icing and finished with edible decorations.","Sugar, Wheat Flour (Wheat Flour, Calcium Carbonate, Iron, Niacin, Thiamin), Rapeseed Oil, Pasteurised Egg, Glucose Syrup, Glucose Fructose Syrup, Palm Oil, Raspberry Concentrate, Humectant (Glycerine), Palm Stearin, Maize Starch, Raising Agents (Diphosphates, Sodium Bicarbonate), Emulsifiers (Mono and Diglycerides of Fatty Acids, Mono and Diacetyl Tartaric Acid Esters of Mono and Diglycerides of Fatty Acids, Sodium Stearoyl-2-Lactylate, Soya Lecithin, Sunflower Lecithin), Tapioca Starch, Wheat Starch, Preservative (Potassium Sorbate), Salt, Gelling Agent (Pectin), Acidity Regulators (Citric Acid, Sodium Citrate), Stabilisers (Tragacanth, Xanthan Gum), Skimmed Milk Powder, Colours (Beetroot Red, Curcumin, Riboflavin, Anthocyanins, Beta Carotene), Dried Egg White, Flavouring, Spirulina Concentrate, Sweet Filling 11%, Raspberry Jam 8%",Nan,Energy1679kJ822kJ-399kcal195kcalFat13.5g6.6gof,https://www.tesco.com/groceries/en-GB/products/297570814
Tesco Birthday Cake Cubes 15Pk,(12),4.8,10.00,"15 Cubes of chocolate flavoured sponge cake filled with chocolate flavoured buttercream, covered with milk chocolate and topped with coloured decorative icing.","INGREDIENTS LIST:Milk Chocolate (42%), Chocolate Flavoured Buttercream (15%), Wheat Flour, Sugar, Egg, Glucose Syrup, Fat Reduced Cocoa Powder, Humectant (Glycerine), Palm Oil, Whey Powder (Milk), Water, Raising Agents (Disodium Diphosphate, Sodium Bicarbonate), Palm Kernel oil, Shea Fat, Emulsifiers (Mono- and Di-Glycerides of Fatty Acids, Polyglycerol Esters of Fatty Acids, Soya Lecithins), Acidity Regulators (Sodium Acetate, Acetic Acid, Citric Acid), Salt, Preservative (Potassium Sorbate), Sunflower Oil, Flavouring, Maltodextrin, Colours (Beetroot Red, Paprika Extract, Beta-Carotene), Fruit And Vegetable Concentrates (Radish Concentrate, Safflower Concentrate, Blackcurrant Concentrate, Apple Concentrate, Lemon Concentrate), Stabiliser (Xanthan Gum).Milk Chocolate contains: Sugar, Cocoa Butter, Cocoa Mass, Dried Skimmed Milk, Milk Fat, Emulsifiers (Soya Lecithins, Polyglycerol Polyricinoleate), Palm Oil, Shea Fat, Flavouring.Chocolate Flavoured Buttercream contains: Sugar, Butter (Milk), Humectants (Glycerine), Fat Reduced Cocoa Powder, Water, Glucose Syrup, Maize Starch, Dried Egg White, Preservative (Potassium Sorbate), Salt.",Energy 1892kJ / 452kcal ,Energy1892kJ / 452kcal838kJ / 200kcalFat20.5g9.1gSaturates13.8g6.1gCarbohydrate60.6g26.8gSugars46.5g20.6gFibre2.2g1.,https://www.tesco.com/groceries/en-GB/products/284515383
