Name,Review_Count,Rating,Prices,Description,Ingredients,Cal,Nutrition,url
Sheba Select Slices Poultry In Gravy 12X85g,(1),5,3.99,Complete Wet pet food for adult cats.,"Best before date: see side. Batch number, Factory identification Number: see individual pack.",Nan,"Protein:9.0Fat content:5.0Inorganic matter:2.0Crude fibre:0.30Moisture:82.0Copper (Copper(II) sulphate pentahydrate):1.3 mgIodine (Calcium iodate, anhydrous):0.34 mgIron (Iron(II) sulphate monohydrate):16.8 mgManganese (Manganous sulphate, ",https://www.tesco.com/groceries/en-GB/products/293812956
Webbox Natural Senior Cat Food Selection 11+ 1200G,(5),4.6,3.49,Why not get social with us?,"Unopened, store in cool, dry conditions away from direct sunlight. Once open, store in the refrigerator and use within 48 hours.",Nan,Crude Protein8.5%Crude Fat4.5%Crude Fibre0.5%Crude Ash2.5%Moisture82%Vitamin D3250IUVitamin E15mgBiotin20μgZinc (Zinc Sulphate Monohydrate):15mgCopper (Copper Sulphate Pentahydrate):1mgManganese (Manganous Sulphate Monohydrate):1mgTaurine445mgCalorie C,https://www.tesco.com/groceries/en-GB/products/305521625
Webbox Natural Meat Selection In Gravy 12X100g,(1),5,3.49,A complete pet food for adult cats,Store in a cool dry place.,Nan,Crude Protein8%Crude Fibres0.3%Crude Fats5%Crude Ash2%Moisture82%Vitamin D3250 IUVitamin E15mgCopper Sulphate Pentahydrate1mgManganese Sulphate Monohydr,https://www.tesco.com/groceries/en-GB/products/295195708
Good Boy Dog Toy Flashing Ball,(3),2.3,4.50,Green Dot,Nan,Nan,Nan,https://www.tesco.com/groceries/en-GB/products/304383524
Iams Cat Food Senior With Chicken 800G,(4),5,3.99,For Vitality Senior Cat Food with Fresh Chicken,"Dried Chicken & Turkey 42% (Chicken 25%, A Natural Source of Taurine), Maize, Sorghum, Fresh Chicken (4.1%), Pork Fat, Dried Beet Pulp (2.4%), Chicken Gravy, Maize Grits, Fructooligosaccharides (0.69%), Potassium Chloride, Fish Oil, Brewer's Dried Yeast, Glucosamine (from Animal Tissues): (0.04%)",Nan,Nan,https://www.tesco.com/groceries/en-GB/products/301743490
Sheba Fine Flakes In Gravy Fish Selection 12 X 85G,No ratings yet,Nan,3.99,Sheba Fine Flks In Gravy Fish Seln 12 x 85g ,"Best before date: see side. Batch number, Factory Identification Number: see individual pack.",Nan,"Protein:8.0Fat content:4.5Inorganic matter:1.7Crude fibres0.30Moisture:83.0Copper (Copper(II) sulphate pentahydrate):1.3 mgIodine (Calcium iodate, anhydrous):0.34 mgIron (Iron(II) sulphate monohydrate):16.8 mgManganese (Manganous sulphate, m",https://www.tesco.com/groceries/en-GB/products/305042149
Pedigree Loaf Dog Food Pouches 12X100g,(1),5,3.49,Pedigree® offer a complete range of tasty and wholesome dog food and dog treats,"Serve at room temperature, surplus food can be refrigerated for up to 2 days.Best before date: see side.",Nan,Protein:7.5Fat content:5.5Inorganic matter:2Crude fibres:0.3Moisture:82Calcium:0.4Vitamin D3:250 IUVitamin E:66 mgCalcium iodate anhydrous:0.56 mgCupric sulphate pentahydrate:8.2 mgFerrous sulphate monohydrate:15 mgManganous sulphate monohydrate:8.4 mgZinc sulphate mon,https://www.tesco.com/groceries/en-GB/products/298870360
Wagg Worker Beef & Vegetable 5Kg,No ratings yet,Nan,4.00,Wagg Worker Beef ,"26% Meat Meal & Gravy*(with min 5% Beef**), Whole Grain Wheat, Whole Grain Barley, Vegetable Fibre, Maize, 2% Chicken Fat* (source of Omega 6), Whole Linseed (source of Omega 3), 2.3% Dried Whole Green Peas & Beet***, Minerals & Vitamins, Chicory Root (1000 mg/kg as a source of FOS), Yucca (150 mg/kg), * min 40g hydrated animal ingredients with ** min 18% Beef, *** min 10g Vegetables from Dried Peas and Beet",Nan,"Protein22%Crude Fibre3.5%Omega 61.6%Calcium1.9%Fat Content8%Crude Ash8.5%Omega 30.3%A12,000 iuD31,200 iuE90 mgZn (Zinc Sulphate Monohydrate)50 mgFe (Iron (II) Sulphate Monohydrate)30 mgMn (Manganous Oxide)30 mgCu (Copper (II) Sulphate Pentahydrate)5 mgI (Calcium Iodate Anhydr",https://www.tesco.com/groceries/en-GB/products/303301519
Purina Felix Mixed Selection Tasty Shreds 12X80g,(51),4.5,5.00,Find Felix @catslikefelix.co.uk,"Best before date, registration and batch number: see bottom panel. Keep pet food in a cool and dry place.",Nan,Moisture:78%Protein:13.5%Fat content:2.8%Crude ash:2.6%Crude fibre:0.05%Linoleic Acid (Omega 6 FA):0.5%Nutritional additives:IU/kg:Vit A:800Vit D.:120Vit E:18-mg/kg:Iron (II) sulphate monohydrate:(Fe: 9.3)Calcium iodate anhydrous:(I: 0.23)Copper (II) sulphate pentahydrate:(Cu: 0.8)Mangano,https://www.tesco.com/groceries/en-GB/products/305743799
Felix Tasty Shreds Fish Selection 12X80g,(50),4.7,5.00,Find Felix @catslikefelix.co.uk,"Best before date, registration and batch number: see bottom panel. Keep pet food in a cool and dry place.",Nan,Moisture:78%Protein:13.5%Fat content: 2.8%Crude ash:2.6%Crude fibre:0.05%Linoleic Acid (Omega 6 FA):0.5%Nutritional additives:IU/kg:Vit A:800Vit D3:120Vit E:18-mg/kg:Iron (II) sulphate monohydrate:(Fe: 9.3)Calcium iodate anhydrous:(I: 0.23)Copper (II) sulphate pentahydrate:(Cu: 0.8)Manganou,https://www.tesco.com/groceries/en-GB/products/305743691
Bakers Puppy Dog Food Chicken & Vegetable 1.1Kg,(1),5,2.69,"The Bakers story begins way back in 1851 when Edward Baker set up a family flour business. Fast forward to 1991 when BAKERS Complete was launched, because Edward Baker believed that dry dog food should be every bit as tasty as it is nutritious.","Cereals (Wholegrains 48%*), Meat and Animal Derivatives (16%**), Vegetable Protein Extracts, Oils and Fats, Derivatives of Vegetable Origin, Glycerol, Minerals, Propylene Glycol, Vegetables *** (0.3% Dried Pea and 0.3% Dried Carrot), * Including min. 4% Wheat and 4% Maize, ** Equivalent to 32% Rehydrated Meat and Animal Derivatives, with min 14% Chicken, *** Equivalent to 4% Rehydrated Vegetables",Nan,Protein:25.0%Fat content:12.0%Crude ash:8.0%Crude fibres:3.0%DHA:0.045%Nutritional additives:IU/kg:Vit. A:19 000Vit. D3:1 110Vit. E:90-mg/kg:Ferrous sulphate monohydrate(Fe: 78)Calcium iodate anhydrous(I: 2.0)Cupric sulphate pentahydrate(Cu: 8)Manganous sulphate monohydrate(Mn: ,https://www.tesco.com/groceries/en-GB/products/301086839
Whiskas 1+ Pure Delight Poultry Selection 12X85g,(3),3.7,3.49,Whiskas 1+ Pure Delight Poultry Selection 12x85g ,"Best before date: see side. Batch number, Factory Identification Number: see individual pack.",Nan,"Protein:12.5Fat content:2.0Inorganic matter:1.2Crude fibres:0.20Moisture:83.0Calcium:0.21Phosphorus:0.12Vitamin B1:29.4 mgVitamin D3:250 IUVitamin E:19.6 mgCopper (Copper (II) sulphate pentahydrate):1.5 mgIodine (Calcium iodate, anhydrous):0.28 mgIron (Iron (II) sulphate monohydrate):14.0 mgManganese (Manganous sulphate, monohydrate):2.8 mgZinc (Zinc sulphate, mo",https://www.tesco.com/groceries/en-GB/products/302277400
Good Boy Dog Treats Jumbo Chicken & Carrot Stick 100G,(1),5,2.00,A Complementary Pet Food For Dogs,"Corn Starch, Chicken Breast (30%), Wheat Flour, Glycerin, Dried Carrot (6%), Soya Protein, Salt",Nan,,https://www.tesco.com/groceries/en-GB/products/305255018
Pedigree Dentastix Advanced Dog Chew 80G,(1),5,1.25,"Having healthy teeth and gums is absolutely essential for dogs to be the best version of themselves, because they use their mouths for everything. Pedigree Dentastix Twice Weekly dental dog chews and dental dog treats are scientifically proven to reduce the build-up of plaque at the gum line, where it matters most. This is thanks to the revolutionary texture of these dog sticks that flex around teeth to give a deep clean.","Cereals, Derivatives of Vegetable Origin, Meat and Animal Derivatives (including 4% Chicken), Minerals (including 2.2% Sodium Tripolyphosphate), Oils and Fats",Nan,Protein:4.9Fat content:1.1Inorganic matter:5.9Crude fibres:0.60Moisture:15.0Calcium,https://www.tesco.com/groceries/en-GB/products/302873506
Vanish Pet Expert Carpet Care Foam 600Ml,(2),4,6.00,For ingredients information: www.rbeuroinfo.com,"< 5%: Aliphatic Hydrocarbons, Anionic Surfactants, Polycarboxylates, Phosphates, Perfume, Limonene",Nan,Nan,https://www.tesco.com/groceries/en-GB/products/295336318
Sheba Fine Flakes Succulent Selection In Gravy 12X85g,No ratings yet,Nan,3.99,Sheba Fine Flks Succulent Seln In Gravy 12x85g ,"Best before date: see side. Batch number, Factory Identification Number: see individual pack.",Nan,"Protein:8.0Fat content:4.5Inorganic matter:1.7Crude fibres0.30Moisture:83.0Copper (Copper(II) sulphate pentahydrate):1.3 mgIodine (Calcium iodate, anhydrous):0.34 mgIron (Iron(II) sulphate monohydrate):16.8 mgManganese (Manganous sulphate, m",https://www.tesco.com/groceries/en-GB/products/305043471
Whiskas 7+ Pure Delight Fish Selection 12X85g,No ratings yet,Nan,3.49,Whiskas 7+ Pure Delight Fish Selection 12x85g ,"Best before date: see side. Batch number, Factory Identification Number: see individual pack.",Nan,"Protein:12.0Fat content:2.0Inorganic matter1.2Crude fibre:0.20Moisture:83.0Calcium:0.21Phosphorus:0.12Vitamin B1:29.4 mgVitamin E:19.6 mgTaurine:700 mgCopper (Copper(II) sulphate pentahydrate):1.5 mgIodine (Calcium iodate, anhydrous):0.42 mgIron (Iron(II) sulphate monohydrate):21.0 mgManganese (Manganous sulphate, monohydrate):4.2 mgZinc (Zinc sulphate, mono",https://www.tesco.com/groceries/en-GB/products/302309531
Lilys Kitchen Mini Beef Brgrs For Dogs 70G,No ratings yet,Nan,2.50,LILYS KITCHEN MINI BEEF BRGRS FOR DOGS 70G ,By Appointment to HRH The Prince of Wales Manufacturer of Pet Food Lily's Kitchen Ltd London,Nan,,https://www.tesco.com/groceries/en-GB/products/304407629
Good Boy Dog Treats Pigs In Blankets 80G,(1),5,2.00,A Complementary Pet Food for Dogs,"Chicken Breast (49%), Duck Breast (16%), Pork (16%), Glycerin, Corn Starch, Chicken Liver, Pea Protein, Pork Flavouring (2%), Salt",Nan,Crude ,https://www.tesco.com/groceries/en-GB/products/305519940
Tesco Complete Dog Food Weight Control 3Kg,(3),5,3.00,A complete dry pet food for adult dogs aged 1-7 years.,"CompositionCereals, Meat and Animal Derivatives (19% including 4% chicken in the brown kibble*), Derivatives of Vegetable Origin, Oils and Fats, Vegetable Protein Extracts, Minerals, Vegetables (4% peas in the orange kibble**), Various Sugars, Yeasts.*Brown kibble: typically 25% of product**Orange kibble: typically 15% of product AdditivesColourants, Preservatives, Antioxidants.Nutritional Additives per Kg:Vitamin A  17, 000 IU, Vitamin D3  1, 500 IU, Vitamin E  70mg, Iodine (Calcium Iodate Anhydrous) 2.5mg, Selenium (Sodium Selenite) 0.1mg, Copper (Copper (II) Sulphate Pentahydrate) 8mg, Iron (Iron (II) Sulphate Monohydrate) 60mg, Manganese (Manganese (II) Oxide) 50mg, Zinc (Zinc Oxide) 100mg.               Analytical ConstituentsProtein             21.0%Crude Fibre     4.5%Fat Content     6.0%Inorganic Matter 8.0%Omega 6          1.7%Omega 3          0.2%Calcium           1.7%Calories           323 per 100g",Nan,,https://www.tesco.com/groceries/en-GB/products/278721239
Lilys Kitchen Duck & Venison Suas For Dogs 70G,No ratings yet,Nan,2.50,LILYS KTCHN DUCK & VENISON SUAS FOR DOGS 70G ,By Appointment to HRH The Prince of Wales Manufacturer of Pet Food Lily's Kitchen Ltd London,Nan,,https://www.tesco.com/groceries/en-GB/products/304395406
Lily's Kitchen Slow Cooked Lamb Hotpot 400G,No ratings yet,Nan,2.25,"Come and be social with us Twitter, Facebook and Instagram",By Appointment to HRH The Prince of Wales Manufacturer of Pet Food Lily's Kitchen Ltd London,Nan,Crude Protein10.4%Crude Fat7.3%Crude Ash1.6%Crude Fibre0.5%Moisture73%Vitamin D3200 IUVitamin E20mgZinc (as Zinc Chelate of Amino Acids Hydrate)25mgManganese (as Manganese Chelate of Amino Acids Hydrate)1.4mgIodine (as Calcium Iodate)0.75m,https://www.tesco.com/groceries/en-GB/products/290050122
Peckish Natural Balance Energy Ball Feeder 320G,(1),5,3.50,A complementary feed for wild birds,"Wheat, Beef Tallow, Calcium Carbonate, Ground Maize, Wheat Flour, Sunflower Seed (4%), Red Dari, Ground Mixed Seeds",Nan,Nan,https://www.tesco.com/groceries/en-GB/products/302292393
Dentalife Daily Oral Care Medium 115G,(3613),4.7,1.30,Complementary pet food for adult dogs.,"Cereals (60% Extruded Corn Flour, 5% Wheat Flour), Glycerol, Minerals, Yeasts, Meat and Animal Derivatives (1.2%*), Oils and Fats, *Equivalent to 4% Rehydrated Meat and Animal Derivatives (4% Chicken)",Nan,Moisture:14.5%Protein:7.0%Fat content:2.5%Crude ash:4.5%Crude fibres:0.7%Calcium:1.1%Nutritional additives:IU/kg:Vit A:8500Vit D3:570Vit E:60-mg/kg:Calcium iodate anhydrous:(I: 2.2)Manganous sulphate monohyd,https://www.tesco.com/groceries/en-GB/products/295410121
Iams Senior 7+ Cat Food With Ocean Fish 2Kg,No ratings yet,Nan,9.75,"IAMS for Vitality for senior cats with Ocean Fish is a 100% complete and balanced food for your cat. No fillers, artificial colours, flavours or GMOs. Wheat free (produced in a factory that handles wheat). Our improved recipe contains 88% of animal protein (out of total protein) and added glucosamine to support healthy joints. It is formulated to support urinary health and the strong immune system of your pet. With no fillers, artificial colours, flavours or GMOs and a wheat free recipe (produced in a factory that handles wheat). Only you know your pet's individual character, but IAMS knows the nutrition they need for the 7 signs of healthy vitality.","Dried Chicken & Turkey 41% (Chicken 25%, A Natural Source of Taurine), Maize, Pork Fat, Rice, Ocean Fish (4.1%), Dried Beet Pulp (2.4%), Chicken Gravy, Fructooligosaccharides (0.69%), Potassium Chloride, Fish Oil, Brewer's Dried Yeast, Glucosamine (from Animal Tissues): (0.04%)",Nan,Protein:36%Fat content:12.5%Omega-6 fatty acids:2.5%Omega-3 fatty acids:0.26%Crude ash:7.3%Crude fibres:1.8%Calcium:1.4%Phosphorus:1.2%Magnesium:0.091%Taurine:2000mg/kgVitamin A:61649IUVitamin D3:1772IUVitamin E:153mgL-carnitine:50mgCupric sulphate pentahydrate (copper):10mgPotassium iodide (iodine):1.3mgManganous sulphate monohydrate (manganese):4.7mgZinc oxide (zinc):116mgSodium bisulphate:1%Additives:^(,https://www.tesco.com/groceries/en-GB/products/301743599
Purina One Cat Adult Salmon & Whole Grain 3Kg,(249),4.9,14.50,Complete pet food for adult cats,"Salmon (17%), Dried Poultry Protein, Wholegrain Wheat (17%), Maize, Soya Meal, Wheat Gluten Meal, Maize Gluten Meal, Animal Fat, Dried Chicory Root, Maize Grits, Dried Beet Pulp, Minerals, Digest (with added heat treated Lactobacillus Delbrueckii and Fermentum Powder 0.025%), Yeast",Nan,Protein: 34.0%Fat content: 14.0%Crude ash: 7.5%Crude fibres: 2.5%Omega 6 fatty acids: 2.0%Nutritional additives: IU/kg:Vit A: 33 000Vit D3: 1 000Vit E: 460-mg/kg:Vit C: 140Taurine: 700Ferrous sulphate monohydrate: 204Calcium iodate anhydrous: 2.6Cupric sulphate pentahydrate: 41Manganous sulpha,https://www.tesco.com/groceries/en-GB/products/257974173
Wagtastic Treat Chicken Fillets 320G,No ratings yet,Nan,7.50,A Complementary Pet Food for Dogs,"Chicken Breast 90%, Tapioca Starch, Glycerin, Salt",Nan,,https://www.tesco.com/groceries/en-GB/products/299153453
Encore Cat Food Fish Selection Tins 12X70g,(3),5,11.00,Facebook,"Produced 36 months prior to best before date.For best before, batch number and factory number, see base of pack.",Nan,,https://www.tesco.com/groceries/en-GB/products/295647307
Encore Cat Food Mixed Selection Tins 12X70g,(4),5,11.00,Find us on Facebook,"Produced 36 months prior to best before date.For best before, batch number and factory number, see base of pack.",Nan,,https://www.tesco.com/groceries/en-GB/products/295647267
Sheba Select Slices Poultry Selection In Gravy 40X85g,No ratings yet,Nan,11.99,Complete Wet pet food for adult cats.,Best before date: see side.,Nan,"Protein:8.5Fat content:4.5Inorganic matter:2.0Crude fibre:0.30Moisture:82.0Copper (Copper(II) sulphate pentahydrate):1.3 mgIodine (Calcium iodate, anhydrous):0.34 mgIron (Iron(II) sulphate monohydrate):16.8 mgManganese (Manganous sulphate, monohydrate)3.4 mgZinc (Zinc sulphate, monohydrate)17.9 ",https://www.tesco.com/groceries/en-GB/products/304789937
Lily's Kitchen Grain Free Variety 6X400g,(1),5,12.50,Come and be social with us...,By Appointment to HRH The Prince of Wales Manufacture of Pet Food Lily's Kitchen Ltd London,Nan,-104kcal/100gCrude Protein10.3%Crude Fat6.6%Crude Ash2.%Crude Fibre0.4%Moisture79%Vitamin E20mgZinc (as Zinc Chelate of Amino Acids Hydrate)25mgCopper (as Copper (II) Chelate of Amino Acids Hydrate)2mgManganese (as Manganese Chelate of Amino Acids Hydrate)1.4mgIodine (as Calcium ,https://www.tesco.com/groceries/en-GB/products/298870567
Sheba Fresh Cat Poultry Collection In Gravy 15X50g,(1),5,3.70,"Sheba Fresh Choice cat food recipes are specially produced with delicately sliced pieces, served in a tender gravy your cat will adore. Perfect servings of Sheba wet cat food in gravy for fresh-tasting cat food every mealtime. A wonderful way to keep your feline friend interested, time after time, choose Sheba Fresh Choice with Poultry in Gravy; available in handy 15 x 50g cat food pouches, for a fresh serving every time. A 100% Complete and Balanced wet cat food with no artificial colours or preservatives.",15 x 50g ℮,Nan,"Protein:8.0Fat content:5.0Inorganic matter:1.9Crude fibres:0.30Moisture:83.0Copper (Copper(II) sulphate pentahydrate):1.3 mgIodine (Calcium iodate anhydrous):0.34 mgIron (Iron(II) sulphate monohydrate):16.8 mgManganese (Manganous sulphate, m",https://www.tesco.com/groceries/en-GB/products/302308440
Iams Dog Food Adult Light In Fat With Chicken 2Kg,(3),5,7.00,For Vitality Adult Dog Food Light in Fat with Fresh Chicken,"Maize, Dried Chicken & Turkey 19% (including Chicken 11%), Maize Grits, Barley, Sorghum, Fresh Chicken (4.1%), Animal Fat, Dried Beet Pulp (3.8%), Chicken Gravy, Minerals (including Sodium Hexametaphosphate (0.38%)), Fructooligosaccharides (0.21%), Fish Oil, Brewer's Dried Yeast",Nan,Nan,https://www.tesco.com/groceries/en-GB/products/301743645
Lily's Kitchen Chicken & Duck Dry Food 1Kg,No ratings yet,Nan,7.00,Come and be social with us,By Appointment to HRH The Prince of Wales Manufacturer of Pet Food Lily's Kitchen Ltd London,Nan,"Crude Protein23.5%Crude Fat12.0%Crude Fibres3.5%Crude Ash7.0%Omega 61.8%Omega 31.2%Calcium1.1%Phosphorus0.8%Energy359 kcal/100gVitamin A (as Retinyl Acetate)18,000 IUVitamin D3 (as Cholecalciferol)1,800 IUVitamin E (as Alpha Tocopherol Acetate)150 IUZinc (as Zinc Chelate of Amino Acids Hydrate)50mgManganese (as Manganese Chelate of Amino Acids Hydrate)10mgCopper (as Copper (II) Chelate of Amino Acids Hydrate)9mgSelenium (as Organic Selenium S. cerevisiae C",https://www.tesco.com/groceries/en-GB/products/290050715
Purina One Cat Indoor Formula Turkey W/Grain800g,(67),4.9,5.50,Complete pet food for adult cats.,"Turkey (17%), Wholegrain Wheat (17%), Dried Poultry Protein, Maize, Soya Meal, Maize Gluten Meal, Wheat Gluten Meal, Animal Fat, Dried Beet Pulp, Natural Dried Chicory Root (2%), Minerals, Digest (with added heat treated Lactobacillus Delbrueckii and Fermentum Powder 0.025%), Yeast, With Antioxidants",Nan,Protein:34.0 %Fat content:13.0 %Crude ash:7.5%Crude fibres:6.0%Omega 6 fatty acids:2.0%Vit A:36 960Vit D3:1 200Vit E:460Vit C:140Taurine:780Ferrous sulphate monohydrate:220Calcium iodate anhydrous:2.8Cupric sulphate pentahydrate:45Manganous sulphat,https://www.tesco.com/groceries/en-GB/products/266166046
Harringtons Poultry Selection Box Dog Food 6X400g,(17),4.9,6.00,HARRINGTONS POULTRY SELN BOX DOG FOOD 6X400G ,"Store in a cool, dry place. Keep unused contents in a sealed container. Keep refrigerated and use within 72hrs.Best Before & Batch Code: See side of plastic tray.",Nan,Protein8.5%Fat Content6.5%Crude Ash2.5%Crude Fibre0.4%Moisture75%Vitamin A3000 IUVitamin D3420 IUVitamin E40 mgZinc (as Zinc Sulphate Monohydrate)38.57mgManganese (as Manganous Sulphate Monohydrate)3.75mgIodine (as Calcium Iodate Anhydrous)0.39mgSelenium (as Sodium S,https://www.tesco.com/groceries/en-GB/products/305249406
"Harringtons Grain Free Chicken, Sweet Potato & Vegetable 2Kg",(22),4.8,6.50,Caring for the environment,"Chicken (30% including 4% Freshly Prepared Chicken and 26% Dried Chicken), Sweet Potato (26%), Potato, Peas, Chicken Fat, Beet Pulp, Linseed, Chicken Gravy, Vitamins & Minerals, Dried Chicory (0.1%), Yucca (0.02%), Recipe: 30g of Fresh and Dried Chicken in every 100g Kibble",Nan,"Protein23%Fat Content12%Crude Fibre3.5%Crude Ash8%Omega 62.0%Omega 30.5%Vitamin A16,000iuVitamin D31600iuVitamin E150mgIron (Iron Sulphate Monohydrate)50mgManganese (Manganous Oxide)50mgZinc (Zinc Sulphate Monohydrate)50mgCopper (Copper (II) Sulphate Pentahydrate)5mgIodine (Calcium Iodate Anhydrous)1mgSelenium (Sodium Selenite)0.1mgAdditives (Per kg):-Nutritional Ad",https://www.tesco.com/groceries/en-GB/products/302038730
Aquarian Tropical Fish Flakes 50G,No ratings yet,Nan,4.50,"A complete, balanced diet for tropical fish.","Fish and Fish Derivatives, Cereals, Oils and Fats, Vegetables (including 0.8% Beetroot), Derivatives of Vegetable Origin, Minerals, Fruit, Yeasts, Algae",Nan,Protein:35Fat content:11.9Inorganic matter:11.4Crude fibres:1Vitamin A:43900 IUVitamin D:3200 IUVitamin C:457 mgVitamin E:381 mgCalcium iodate anhydrous:0.35 mgCupric chelate of amino acid hydrate:0.7 mgCupric sulphate pentahydrate:0.7 mgFerrous chelate of amino acid hydrate:14.1 mgFerrous sulphate monohydrate:7 mgManganese chelate of amino acid hydrate:3.8 mgManganous sulphate monohydrate:4.5 mgSelenium selenite:0.09 mgSodium molybdate dihydrate:0.02 mgZinc,https://www.tesco.com/groceries/en-GB/products/252443988
Harringtons Adult Dog Mixed Selection Box 6X400g,(22),4.8,6.00,"Complete, 100% natural and utterly delicious - made with our unique FreshCook® process.","Store in a cool, dry place. Keep unused contents in a sealed container. Keep refrigerated and use within 72 hrs.Best Before & Batch Code: See side of plastic tray.",Nan,Protein8.5%Fat Content6.5%Crude Ash2.5%Crude Fibre0.4%Moisture75%Vitamin A3000 IUVitamin D3420 IUVitamin E40 mgZinc (as Zinc Sulphate Monohydrate)38.57 mgManganese (as Manganous Sulphate Monohydrate)3.75 mgIodine (as Calcium Iodate Anhydrous)0.39 mgSelenium (as Sodium S,https://www.tesco.com/groceries/en-GB/products/304410551
Hilife Natural Multipack Broth 5X100g,(1),5,4.80,A complementary pet food for adult dogs.,"Store in a cool, dry place. Once opened, store in an airtight container in the fridge but return to room temperature before feeding. Use within 24 hours.For best before & factory reg. nos.: see panel.",Nan,,https://www.tesco.com/groceries/en-GB/products/298895745
Freshpet Chicken Spinach & Potato Dog Food 680G,(2),5,4.50,Learn more at freshpet.co.uk,"Chicken (73%), Chicken Liver (12%), Potatoes (6%), Pea Fibre, Egg (1%), Minerals, Spinach (0.5%), Garlic Powder, Celery Seed Powder",Nan,Protein10.0%Fat Content8.0%Crude Fibre1.5%Crude Ash2.5%Moisture74.0%Vitamin E60 IUZinc Chelate of Amino Acids Hydrate(Zinc 39 mg)Iron (II) Chelate of Amino Acids Hydrate(Iron 30 mg)Copper (II) Chelate of Amino Acids Hydrate(Copper 2.6 mg)Manganese Chelate of Amino Acids Hydrate(Manganese 2.2 mg,https://www.tesco.com/groceries/en-GB/products/291899268
Purina One Senior 11+ Dry Cat Food Chicken 800G,(31),4.9,5.50,Complete pet food for cats aged 11 years and over,"Chicken (17%) (including Bone, Meat, Skin), Dried Poultry Protein, Wholegrain Wheat (15%), Corn, Corn Protein Meal, Wheat Gluten, Soya Meal, Animal Fat, Wheat Middlings, Dried Chicory Root (2%), Minerals, Digest (with added heat treated Lactobacillus Delbrueckii and Fermentum Powder 0.025%), Yeasts",Nan,Protein:38.0%Fat content:15.0%Crude ash:7.5%Crude fibres:2.5%Omega 3 fatty acids:0.1%Omega 6 fatty acids:2.0%Nutritional additives:IU/kg:Vit A:38000Vit. D3:1200Vit E:670-mg/kg:Vit C:140Taurine:1200Iron(II)sulphate monohydrate:(Fe: 49)Calcium iodate anhydrous:(I:1.2)Copper (II)sulphate pentahydrate:(Cu: 7.7)Manganous sulphate monoh,https://www.tesco.com/groceries/en-GB/products/303227142
Peckish Daily Goodness Nuggets 1Kg,(1),5,3.50,Why feed different types of food?,"Wheat Flour, Beef Tallow, Peanut Flour (14%), Black Rapeseed, Linseed, Red Millet, Ground Mealworms, Additives: Peanut Flavouring",Nan,Nan,https://www.tesco.com/groceries/en-GB/products/299513581
"Iams Dog Food Puppy Small, Medium With Chicken 800G",(5),3,3.00,For Vitality Puppy Food Small/Medium Breed with Fresh Chicken,"Dried Chicken & Turkey 32% (including Chicken 19%), Maize, Maize Grits, Animal Fat, Fresh Chicken (5.0%), Rice, Dried Beet Pulp (3.3%), Chicken Gravy, Minerals, Fish Oil, Dried Whole Egg, Fructooligosaccharides (0.21%), Brewer's Dried Yeast",Nan,Nan,https://www.tesco.com/groceries/en-GB/products/301744454
Sheba Fine Flakes Poultry Selection In Gravy 12X85g,No ratings yet,Nan,3.99,Sheba Fine Flks Poultry Seln in Gravy 12x85g ,"Best before date: see side. Batch number, Factory Identification Number: see individual pack.",Nan,"Protein:8.0Fat content:4.5Inorganic matter:1.7Crude fibres0.30Moisture:83.0Copper (Copper(II) sulphate pentahydrate):1.3 mgIodine (Calcium iodate, anhydrous):0.34 mgIron (Iron(II) sulphate monohydrate):16.8 mgManganese (Manganous sulphate, m",https://www.tesco.com/groceries/en-GB/products/304788253
Harringtons Complete Senior Dog Chicken 2Kg,(19),4.9,3.95,Caring for the Environment,"26% Chicken and Meat Meals (6.5% Dried Chicken*), Rice (20%), Maize, Barley, Beet Pulp, Oat Groats, Poultry Gravy, Salmon Oil, Minerals, Seaweed (0.1%), FOS (0.1%), Glucosamine (0.05%), Chondroitin (0.01%), Yucca Extract (0.01%), *6.5% Dried Chicken, equivalent to 26g Chicken in every 100g Kibble",Nan,"Protein20.5%Fat Content7.5%Crude Fibre3.5%Crude Ash8.5%Omega 61.1%Omega 30.4%Vitamin A15,000 iuVitamin D31500 iuVitamin E100mgIron (Iron Sulphate Monohydrate)50 mgZinc (Zinc Sulphate Monohydrate)50 mgManganese (Manganous Oxide)40 mgCopper (Copper (II) Sulphate Pentahydrate)5 mgIodine (Calcium Iodate Anhydrous)1 mgSelenium (Sodium Selenite)0.1 mgAddit",https://www.tesco.com/groceries/en-GB/products/298904385
